video_id,comment_text,likes,replies,pol
_0d3XbH12cs,"The video, the song, the lyrics, the vibe...the whole thing is so symbolic for where I am at in life right now. It's not the first or second time that that's happened for me with Kimbra's music. Keep coming back to watch this.",0,0,0.14714285714285716
W-8nCyXm03E,Air nibba,0,0,0.0
jK6BesOrfws,How about in the ground? Lol 😂 (extends hand) what!?? Hahaha,0,0,0.6
L3O6LocRoTo,Hbo must be really happy because watchmen is basically a naked comic,0,0,0.35000000000000003
GfqD5WqChUY,Awesome video. 🤡,1,0,1.0
WQjO1mMCPg4,"Damn, Keith was the real MVP for this one. I don't know what they had him bite into at the end, but it did not look good at all.",0,0,0.44999999999999996
2m65xSqUWaI,"1,5m for a blanket?",15,6,0.0
vVnJKV8aScc,3:37 THATS WHAT SHE SAID :D,1,0,1.0
q0B8k3UPZNc,who is this review for ? 99% of the viewers can't afford this,0,0,0.0
E5Hfl6Nqw3Q,This wack asl,0,0,0.0
ZGlYvprDKNM,That WiLodia moment ♥,0,0,1.0
AX8-YzMKZhQ,🔥🔥🔥    AAA   🔥🔥🔥      AAAA\n🔥             AAA         🔥          AAAA\n🔥🕌🔥    AAA     🔥              AAAA\n🔥🔥🔥    AAA     🔥🔥🔥    AAAA,0,0,0.0
rfMJ-DylWBs,EWW: Hacksaw Ridge,0,0,0.0
4X6a3G_0HjY,Someones gonna get fiiireeeed,0,0,0.0
KCNvREKTnQc,"Using the full range of MacFarlane expressions. Both of them. I mean, have you SEEN The Orville.",0,0,0.01874999999999999
2Lq5pZrbpHc,Im watching this video right and your saying that Thormunt Thunderfist had 2 childeren with Alysane Mormont. He's claims he had sex with a bear so maybe its not an actual bear but a Mormont like Alysane.,0,0,0.14285714285714285
p25S_5P6ejg,Love your review. It's great how honest you are and your still nice about it. The world needs more people like you 💕,0,0,0.6
wVD8ECqG2FM,"i sure love me some chewing noises, sure glad the editor didn't edit that out like a normal sane person would",1,0,0.43
zcqZHYo7ONs,"Wut if hat dang refraction changes the dad gum polarity of sum waves a little bit, when it changes the direction of the gold darn wave boy howdy 'n wut knot?",0,0,-0.1875
e2jMJV6UHWU,"No one is probably going to read this,\nBut i don't mind writing it because I feel at least one person will read it.\n\nI'm an artist pursuing my dreams & pray that my dream will someday be a reality. I have my latest video up on my channel & would love the support from anyone. \n\nEither leaving a like on this comment, liking one of my videos or subbing to my channel would mean a lot to me. \n\nJust some simple views & subs can get me closer to living my dreams. Thank you:)",0,0,0.14791666666666667
_lnPimlBnk4,Bruh i dont even drink 1L of water here,0,0,0.0
2jvi4e0NIHs,what size did you get the jean jacket in?,0,0,0.0
cCqS5X_zu-g,Fake hoax shooting!,0,1,-0.625
GDrudkqrgIA,"Let me guess, nothings goin on? Its a misunderstanding? The left is blowing this out of proportion?",0,0,0.0
F66vX1WCRbs,Platten😍MI Favorita🔥👍,0,0,0.0
0501BTnbrxg,OMG NF IS ON TRENDING FINALLY,0,0,0.0
zqE-ultsWt0,"Guys just so you know this isn't gonna be a million dollars it's supposed to be the cost of an airline ticket. I'm not sure if it will be higher or lower, but I have faith in this\n\n\n\n\n\n\nAnd I wonder how the meme community will react to this. They'll probably do the thing:\n\n\niPhone X 999.99                     Literal trip into space that takes you anywhere on earth in less that 30 mins 199.99",0,0,-0.05555555555555555
UxrTnLgO1YM,OMG that was too good we love you 😍😍😍😍😍😍😍😍😍😍,0,0,0.6
REyxoxScrbU,"I felt identified with minute 1 : I dont like to talk but I love to sing, I dont like to Smoke but I love to drink",0,0,0.5
pXFIMdJduvY,This song is so good🎹,0,0,0.0
W-8nCyXm03E,"12g co2 is one of the most common, especially for airsoft",0,0,0.06666666666666667
QB5JOnDYeHY,Do Larry David!,0,0,0.0
IRdrt8nPyy8,Move To The google search And then Type: *FreeCodesXXX* Now this happens to be the purely working FIFA 14 coins working from this month. Dont waste your entire precious time on other software,0,0,0.07785714285714285
941Bl3oxk8Y,Wow you guys are awesome ❤️❤️❤️❤️,0,0,0.55
B7YaMkCl3XA,communism will save them,0,2,0.0
73kIG3HcFq0,One of your best videos about one of my favorite movies. You somehow captured how I felt about Her in words.,0,0,0.75
WYYvHb03Eog,lol iphone 10? we're still at the 7 bruh,0,0,0.8
SHq2qrFUlGY,Shakira se que no Leerás este comentario pero te quiero decir que me encantan tus cansiones y tu nuevo color de cabello en encanta y ya e escuchado un millón de veses me encanta la colaborasion de nicky jam y tu,0,1,0.0
XM23h-eJ08A,ARSENAL,0,0,0.0
_Z3P18GHej8,I love this,0,0,0.5
Oo0NJsr5m4I,I have broken to much glass in my life to walk on that shit 😤🖕🏾... fuk no glass is after my ass I don't trust that bridge,1,0,-0.13333333333333333
-QL9dvmddYs,와 축하해요ㅠㅠㅠㅠ 애기가 너무 쪼끄매ㅠㅠㅠㅠㅠㅠㅠㅠ💗💗,0,0,0.0
s8GrGvjhz0s,That deli owner just jumped up and down for the business she gave him...ha!,0,0,-0.19444444444444448
gLj21uNEzqA,What a voice..!😍💎🎵🎤,0,0,0.0
6u9LNN9HwC4,Rey goes in a few days from trashcollector to super jedi makes 0 sense even for the star wars vers,0,0,0.06666666666666665
IEGEovFX534,"Tears in my eyes.. beautiful little angels..makes me so hopeful in a time of so much turmoil.. God bless them all and look at that teacher.. you can tell she has put everything in this.. this is perfection.  Thank you, I really needed this.",6,0,0.265625
O12Rt0JSDpA,"It was an adorable Miranda Sings impression, okay?",4,0,0.5
oZlJZ0BhXsA,All of this has happened to me at least five times a week,0,0,-0.3
cFVRCo6-FUU,"They make all sorts of pumpkin based dog treats, and I think they purposely don't make the pumpkin noticeable.\n\nI get them for my rabbits, because the treats are vegan (bunnies don't eat meat) and full of stuff rabbits can have in moderation. They often come in fruit flavors, like apple, blueberry and banana.\n\nBut I think advertising the dog treatsas a pumpkin treat for fall is a gimmick. I suspect the treats taste the same. The pumpkins blend in with the rest of the flavors.",0,0,0.175
8Lv3tW7bWzU,Have you read Annihilation? It's pretty great in terms of weird sci-fi.,0,0,0.18333333333333335
6qCqrODw1nM,Finally I'm getting an r rated home alone,0,0,0.0
6u9LNN9HwC4,Institutional fresh less crowd competition guilty senior.,0,0,-0.12222222222222223
adfcVmu1bmM,Wow,0,0,0.1
2LkEa-JV9Kc,Or you're just like me and don't have any.... yay :(,5,0,-0.75
XpVt6Z1Gjjo,they should've gifted you cyanide,0,0,0.5
LnxSTShwDdQ,Nope   nope nope no no nope no nope,0,0,0.0
d8U5funnyA8,Can you people get me to 100 subscribers,0,0,0.0
Ayb_2qbZHm4,ucla jan steps,0,0,0.0
BNJUsE7pEs4,"Amen sir, Amen.",0,0,0.0
n4wFyyW71zs,Kocham Was!!!! ❤💙\nI love you!!!!💚💜💋,0,0,0.5
41taYOq1kVY,http://vire.info/?cash=12982,0,0,0.0
cWIEF2Yc58w,"It sucks that Jon seems like such a good and sweet talented person, but that professionaly Stephen doesnt have the guts to tell him to either be quieter or turn off his Mic. It's like he's nice, but his intersections really do ruin the show a bit",0,0,0.32142857142857145
rrZk9sSgRyQ,Yassd,0,0,0.0
83ZrTybo2t4,Why cant we bite each other on the face when we see someone we've been missing for a long time?,0,0,-0.125
a-9IZz8Ry5I,Anyone noticed that the pixel 2 has a camera to the left and the xl has a camera to the right? Lol idk I need a life,0,1,0.36190476190476195
6z-X4r5JkyI,💗💗💗💗,0,0,0.0
M3siIx0W8aM,Was this filmed at Fota Island ?,0,0,0.0
j8ziXMTpkL4,Just like Minecraft,2,0,0.0
yG-yfbDscbo,"All have taken place, you can stop, all the power will be for you",0,0,0.0
Rmg5fLRBkZo,IS IT BAD THAT I WATCH CASEY VLOGS MORE THAN I WATCH REGULAR TV???,0,0,-0.06666666666666661
RA9gg4qBb30,Flushing the Trump. AWESOME.,0,0,1.0
F4ELqraXx-U,Quee of music,0,0,0.0
3VVnY86ulA8,The crazy go pro lady 😂😂😂 love you Justine,0,0,-0.04999999999999999
1NyMSWqIJDQ,Why,0,0,0.0
03IUgOd4GH4,3 mil in 12 hours whoop,0,0,0.0
j3MvNvV27hw,"Colleen, your curly hair is BEAUTIFUL!  It looks soft and light and really suits you, I would say more than when you straighten it.  It's big and fun and has character!",0,0,0.3678571428571429
TdH_NL35Nbw,If Fred Andrews dies we riot,235,31,0.0
AApylcoF9jA,Good thing jacksepticeye moved,0,0,0.7
yWatz9TAgT0,No! I love the blondeeeee!,0,0,-0.3125
FN5n87Gj0LM,I LOVED BLACK MIRROR!!! I'm waiting for the next seasons !!!,0,0,0.1248263888888889
4z4xoO-NGUg,Child beater smh,0,0,0.0
xTyTQgb-y-A,YASSSSS. MY FAVES,1,0,0.0
iALfvFpcItE,Thoughts from people on using mushrooms to stop anxiety? Also anyone have any thoughts on low dosing oxytosin to treat? SSRI is a no go. It's not for me but a loved one.,0,0,0.35
8hP6WROycAU,I love this song,0,1,0.5
xHzL1lqNny4,Te amo (:♥,0,0,1.0
5PaDeyRNUyc,Ok but seriously what drugs is Jordan on,1,0,0.08333333333333334
fQxLlq7lxVM,I'm here for it girl !,0,0,0.0
SjZWJoNYpHI,Pop punk almost ten years before Green Day and with more integrity.,45,7,0.09999999999999999
FpZ1sIjQrf4,what yp,0,0,0.0
2zISrf-7V3U,"I'm oily skin and tried it out but sadly 😔it didn't work for me after 3 hours I was oily, but I still give Rhianna props her collection is gorgeous and it did not oxidized on me.",0,0,0.09999999999999998
H1YGg8nYkv0,I would've shot her,0,0,0.0
Y2GVVC_cD_E,His smile looks like burak deniz,0,0,0.3
03IUgOd4GH4,Helga Sounds Different,0,0,0.0
QQVWMp_xgGg,Just realized that we have a lot of dumb citizen....,0,0,-0.375
8oyf8Ecwo-Y,This will never be the newpenny dreadful.,0,0,-1.0
mceaM2_zQd8,This is literally a cut down version of 3 Blue 1 Brown's vid,0,1,-0.07777777777777779
MiFeES9uOSo,Oh ...,0,0,0.0
5XpbCWsHWKQ,Flopsun annecim 😣,0,0,0.0
S_DltnHeJ-M,"I like your new hair, thought I don't know if it's new but it's new to me and I like it so there. Compliment achieved.",0,0,0.13636363636363635
8NArIVIQ4BI,These are things where after you question why soap is named soap,0,0,0.0
LrvnTWNATG0,what a shitty replay,0,0,0.0
APHgDFRpCi0,Its worse then I thought it would be. Pharrell Williams in safari was good a good idea this was not.,0,0,0.3333333333333333
yNaLblrdflU,Esta mierda de trabolta o trebol es siempre lo mismo pura cagada de zorrillo pinches directores no saben buscar gente que traiga reating pinche viejo no vale verga y ahi lo traen.,0,0,0.0
rfMJ-DylWBs,Hell yea b0i n3w vide0,0,0,0.0
O78Lpo4ctSE,Awww,0,0,0.4
Wp2TUPo5W0c,"Thank you for sharing, Dan. I agree about the feeling of the 'black hole'- except for me, it feels more like a black storm cloud in my mind, made of irrational thoughts like the ones you described. Sleeping too much or too little is also big in my life, as well as the lack of appetite (it kinda feels like I'm either not allowed to eat, or I do it to keep myself busy). If I may add another tip here, though, cleaning is a good physical activity that will help both in self-care and productivity. Just getting up to make your bed is a good start. When I clean the carpet of the kitchen or do the dishes, it makes me feel like I actually have purpose and influence in my surroundings- it makes me feel like I have control. Again, thank you for sharing this, and I wish you all the best in the future.",0,0,0.2175595238095238
DyTlOIa6RLo,Holy fuck that father is greedy,0,0,-0.4
6gwM9v_OwUc,Best season of Rupaul. Laganja is forever and always my fave.,5,2,1.0
Upqp21Dm5vg,"could you do a video on chillis and dishes to make with them, my mum bought a carolina reapers without knowing the heat",0,0,0.0
LunHybOKIjU,HAPPY BIRTHDAY EMINEM..!!!!(The King Of Rap),1,0,0.8
CDfhFfKSohc,The trolls for Putin are out in full force. The Russian payroll for Trumptards who enjoy trolling is astronomical.,0,1,0.25
c_weoC3HT6Q,Yuri on ice,0,0,0.0
gIE105f0ejg,Get ready to buy 4 million sprinkles James,0,0,0.2
jY9xBAAa5fs,I'm dead inside😑,0,0,-0.2
0H3MirHyX2w,Wow,0,0,0.1
YicuZ0gYH_o,Wow. Some actual good news.,0,0,0.26666666666666666
2WIzsHMcSp4,#HoloOutfit,0,0,0.0
H1YGg8nYkv0,AMERICANS DONT RESPECT WOMEN PERIOD,3,7,0.0
9HIkG6vMk6E,He's tall looking,0,0,0.0
oqmSuPJfvJo,"Usually, when I come to this channel, I am expecting to see Corinne do a project and Rob just, you know, cut himself somehow. So, I was kinda disappointed with the last cheesecake video results - just because it went wrong for bad execution rather than the project itself - but we got it now heeeey\n\nAnd damn, people are harsh...",0,0,-0.39999999999999997
LolP3Y7_Irs,#19 On Trending❣️,0,0,0.0
G_SjnHwxWMU,I wish X was physically in the video tho,0,0,0.0
bvomHFZO0mk,Where are my people who were at the animation panel at D23???,0,0,0.0
A-sDCUXML2E,Stort.,0,0,0.0
bd7IGZ6dulM,*bold?*,0,0,0.3333333333333333
5ggZ9jIHnr8,Tava no #1videos em altas agora tá no #21kkk puts. Só mais a senha do Wi-Fi kkk,0,0,0.0
TaxAsHhex10,"Shut up,  colbert.   Don't be a little pussy all your life.",0,1,-0.1875
efD3nmwF-IM,La wea buena :),0,0,0.5
f24IrRsf-lQ,Woo! I'm totally ready for it!!,0,0,0.3125
7uOvL5eLpeE,Amei ♥ de coração! A letra é maravilhosa,0,0,1.0
_r5eTelhpmQ,Love it.....I call Carolina home as well.,1,0,0.5
y_h_1uN2RQA,Are you single😊💝💝💝💃💕🎶🎶🎶🎶🎶🎤🎤🎤,0,0,0.0
udnGW3E1vxY,perfection,0,0,0.0
RxIh_0q524c,Cool idol can you teach me how to vlogg 😊,0,0,0.35
jKInAMNrXRA,Very well said,0,0,0.2
_38JDGnr0vA,"oh my god the colours are really wonderful, i never saw something like that",0,0,1.0
ktc8XDBq93k,YOU TUBE! you're freezing views again....plz...don't do this...these talented boys deserves more more views for working hard.,3,0,0.3520833333333333
2m65xSqUWaI,He'll be able to buy a new foot.,0,0,0.3181818181818182
uy1FAz6zrQE,0:30 SO FUCKING CRINGY JESUS FUCKING CHRIST WHERE IS MY BLEACH,0,0,-0.6
J7MYJ8Kxhwc,*Eminem stops making music* *NF saves rap*,0,0,0.0
2VXWgIOPgmw,Finally a show about waco! and it looks amazing ! now all we need is a ruby ridge story.,0,0,0.37500000000000006
2eAuJIGlp9I,Seagal is a useless obese fraud. Anyone who goes to Russia and cozies up to murderous dictators like Putin and Kadyrov is going straight to Hell.,3,0,-0.15
48dQekjzI6U,Will why do you wear the fabric over your face?,0,0,0.0
rRi8LptvFZY,sorry but your annoying bleep filled song isnt going to work. Its Velcro. Deal with it.,1,0,-0.3
T6x-kDiQsWM,"I want to see invisible hamsters, jimmy",0,0,0.0
1k_whpRADOE,He did all this to get back at his wife nice,1,0,0.3
FNh2ZsQkNus,You guys took one of my favorite movies ever and turned it into a music video...BEST THING EVER!,2,0,0.625
20yqGk-M-iI,no one likes you he's sooooooooo UGLYYYYYY!!!!!!!!!!!,28,15,0.0
QBGaO89cBMI,The 90's feel damnn,0,0,0.0
oD7nZouNyDA,Yes mama bubz ! I always get dolled up  for shopping,0,0,0.0
r9-DM9uBtVI,The HYPE is REAL bros.,0,0,0.2
vrcG-SckgJk,Look at all the comments of people crying about their unfunny jokes being misinterpreted.,0,0,-0.2
lNzrWNjEQjk,Is this Christian music,0,0,0.0
c2BcR39AtxE,i have the ios 11 and i don’t have these emojis,0,0,0.0
X7ld45pUueQ,"What's that area right past that marker, an even more southern most point, lol",4,0,0.3059523809523809
9fgtEM8-VTI,>be american\n>go to elementary school \n>get shot\n>go to high school\n>get shot\n>go to university\n>get shot\n>go to work\n>get shot\n>join the national guard\n>get shot\n>go to watch my favorite movie\n>get shot\n>go to see my favorite country singer\n>get shot\n\ngod bless the constitutions,0,0,0.365
lbgBzgMzVV8,"I can't believe your mom died, and you said it without crying 🤧",0,0,-0.2
RsG37JcEQNw,"Everytime I think Weezer can't come up with a more cringeworthy chorus than Beverly Hills, they release a new song and I realize it's been going downward for more than a decade now. I mean, seriously? Turn it up, it's the Beach Boys? Jesus Christ. So bad. Well, there will always be Blue, Pinkerton, and Green for me.\n\nP.S.: Yes, White had some good moments. That's it though.",0,0,0.029053030303030303
dN9hA7J79VI,You guys can we get #transleaders trending on twitter since the nfl doesn't allow any trans female cheerleaders,1,0,0.0
k1vE_LVBx4s,About half of American households don't even pay income taxes. Of course tax breaks help you more if you're the one actually paying taxes. How about making the government more efficient and reallocating money to programs that give Americans an equal opportunity to succeed? The function of the government is not to provide an equal outcome.,0,0,0.11904761904761905
gDFZS0BVsBY,In the book Pennywise has an electric blue tie. How could you mess that up?,0,0,-0.0875
HPRQwI5uvBM,how and why is this trending?,14,0,0.0
ZWTlL_w8cRA,❤️❤️❤️,0,0,0.0
Q7o163QU8CE,THATS SO CLOSE TO MY 19TH BIRTHDAY!!!!!!!,0,0,0.0
zqE-ultsWt0,"Wau, love it",0,0,0.5
k9VmfRBkUuM,Haters will say tis photoshopped,88,0,0.0
1z3cp_Mh8bA,They’re both adorable.,0,0,0.5
rfMJ-DylWBs,Can you do everything wrong with Rise of the Guardians please!!!!!!!!!!!!!!!!!!!!!!!!!!!!,0,0,-1.0
12vfxYs6F7E,Learn to bunny hop on a moutain bike,1,0,0.0
5PaDeyRNUyc,SO NOBODY WAS GONNA FIX THAT ONE OUT OF PLACE PIECE OF HAIR ON KYLIES WIG?????,0,0,0.0
AZDiPT4PuHE,can get mo please and do something indian please.☺,0,0,0.0
L00YWl8StuI,Kids in the comments making stale feminist jokes,0,0,-0.5
b-3YW03RR0I,*points at wedding ring*\n-I own you!\n\nI LITERALLY GONNA DIE I NEED AN AMBULANCE,2,0,0.6
G_wmoWfZQAM,"Shay, exfoliate your lips :)",0,0,0.5
4k56sdESwHQ,This one right here is fireeeeeeeee !!! Ringtone ya 2017,0,0,0.5580357142857142
1-mNxzvJSaQ,ayooooo....why kat Williams wit you...tht some  comedy shit.........aaaaaassyyyyyyyyoooooo.....reporting to you LIVE ...... Jesus sandals.....2013 ....brick city new DMVNJNY....EASTSIDE,0,0,0.13636363636363635
XpVt6Z1Gjjo,Ilysfm,0,0,0.0
4yCkkOvIkUI,How is this trending and idubbbz isn't?!,0,0,0.0
9CILSvf1snQ,Love it!!!,0,0,0.9765625
YK53kxDdkiU,"Fuck bron bron, fucked up my nigga Hayward with no regard. \n\nDeadass left the murder scene like nothing happened.",5,8,-0.3333333333333333
WYYvHb03Eog,when do these come out ?,0,0,0.0
PpGyVCu2n9g,Was she worried about Chicago for the last eight years where the death toll raised every year while her husband was president q,1,0,0.0
3X3xtRNb20s,"2U lyrics\n\nNo limit in the sky\nThat I won't fly for ya\nNo amount of tears in my eyes\nThat I won't cry for ya, oh no\nWith every breath that I take\nI want you to share that air with me\nThere's no promise that I won't keep\nI'll climb a mountain, there's none too steep\n\nWhen it comes to you\nThere's no crime\nLet's take both of our souls\nAnd intertwine\nWhen it comes to you\nDon't be blind\nWatch me speak from my heart\nWhen it comes to you\nComes to you\n\nWant you to share that\n(When it comes to you)\n\nCupid ain't a lie\nArrow got your name on it, oh yeah\nDon't miss out on a love\nAnd regret yourself on it, oh\nOpen up your mind, clear your head\nAin't gotta wake up to an empty bed\nShare my life, it's yours to keep\nNow that I give to you all of me, oh\n\nWhen it comes to you\nThere's no crime\nLet's take both of our souls\nAnd intertwine\nWhen it comes to you\nDon't be blind\nWatch me speak from my heart\nWhen it comes to you\nComes to you\n\nWant you to share that\n(Share) When it comes to you\nWant you to share that\n\nWhen it comes to you\nThere's no crime\nLet's take both of our souls\nAnd intertwine\nWhen it comes to you\nDon't be blind\nWatch me speak from my heart\nWhen it comes to you\nComes to you\n\nYou are welcome.",1,0,0.4
5NX-U36VDis,Just get a fucking laptop,0,0,-0.6
oh37J6qROrQ,"Great informational review. Like always, great video.",0,0,0.8
-jFgNreZPf0,Ooooo yeaaaah!!!!!!!!!! ♥,0,0,1.0
a-9IZz8Ry5I,"The Now Playing feature, also known as the we're intercepting all of your conversations, all day long, everywhere you go feature.",0,0,-0.05
IUkNNDg18mY,Press A to give this video a Like 😂😂😂,0,0,0.0
dUBcP00TEWI,Sometimes I feel so bad for these impersonators that put up with Lucas's shenanigans...,0,0,-0.6999999999999998
o97_jDomyqc,Brasil loves You 💕,0,0,0.0
xItHZZ3bvhY,i love seeing Americans divided on stupid things,0,0,-0.14999999999999997
mlxdnyfkWKQ,Ivan the bear,0,0,0.0
Lv3Uy2rjgCE,"I like Sci-Fi and Auto biographies mostly. Don't have a favorite book but I really like Orson Scott Cards works, especially the homecoming series.",0,0,0.3
15ugV2ASveg,How? How the fuck can someone be this talented?,1,0,0.14999999999999997
bvim4rsNHkQ,"Couldn't you, I don't know, just put some parachutes on the thing instead of trying to land it at 40 mph on a tippy barge?",0,2,0.0
DZHAB3PGlfU,It's Sterling K Brown he should always be trending,1,0,0.0
GfqD5WqChUY,"My man. Another vid! Yay! I was all excited to see you FINALLY made another video. Then I saw your face. What? When did he start doing that?\nThen I see another video of yours I previously hadn't. You upload every Wednesday? What? Am I not subscribed??\n\nTurns out that YouTube has failed us both. Despite being subscribed, your videos weren't showing up in my sub feed. While I was immensely disappointed previously, I am now elated and looking forward to more of your content! BTW, Wisecrack is fantastic too. Nice call-out. (I realize this is not the right video for that.)",0,0,0.07023809523809524
AApylcoF9jA,Lol i can see trump now....those damn irish asking for money from there government to help repair infrastructure how dare they this is bad really really bad for potatoes how will i have my fries,0,1,-0.1499999999999999
ZVPTxFZTQis,"Trunk in the front, call it elephant...fire!!!!",0,0,0.0
2m65xSqUWaI,Hope that guy's prepared for all the shitty relatives in his life coming out of the woodwork trying to sue him and beg for loans.,1,0,0.0
r8jWAvF3rcE,Why why why why WHYYYY did I google Cyclopia human?! DON'T DO IT!!! IT'S A TRAP!!!!!!!,0,0,0.0
3QzUSSKfEeA,This song makes me wanna watch,0,0,0.0
YQYslaA1Lus,I miss the old kanye\nChop up the beats kanye.,1,0,0.1
ScNsBpQ8KIg,Bonneville!! The best,1,0,1.0
2DTwXdqmRiM,His name is Jeff,0,0,0.0
TdH_NL35Nbw,Whyy,1,7,0.0
0Pz7DnHikLU,wonder what Connor thinks.,0,0,0.0
FgSSk7xLW9w,Or maybe its just a placebo,0,0,0.0
ORSMs7lZtdY,Dude was going to run to the Philippines!,1,0,0.0
jK6BesOrfws,raw,0,0,-0.23076923076923078
YicuZ0gYH_o,Holy fucking shit. That name is perfect for PR lol.,0,0,0.5333333333333333
nvAhI3ZjnjU,You can’t play impressions without having Donald trump in there somewhere,1,0,0.0
C1i3ESnliMQ,What if you only ate pizza,0,0,0.0
-zCYX0esYlo,Am I the only person that saw Nick Kroll....?,0,0,0.0
WRzqSDyOSbY,"Mad, more videos with Cami 😍😍😂",0,0,-0.0625
Oo0NJsr5m4I,"I don't trust the damn thing, I've seen too many videos of Chinese kids and mothers sucked into collapsing elevators and escalators.",0,0,0.25
JU21shbaVBo,You wouldn't believe all the famous artists that copied. So cartoonists do it too. Not really surprised.,0,0,0.225
px7dYqZPk6I,One Direction are better,1,0,0.5
UxrTnLgO1YM,This has to be one of your best videos. Loving the hiccups! XD,0,0,0.875
1ZNZY-gd3K0,woe to the man who leads my flock astray,0,0,0.0
EmlH7yRKmSY,Am I the only one enjoying looking at all the different ones and then it's like Holy God the fatty in the front row that's clearly fed pancakes and bacon and eats at the table with the fam. The only thing that ones herding will be his diabetes,0,0,0.06666666666666667
hNsUtZmWgdg,"Как-то странно - попадание всегда в одно и то же место... Может в этом месте закладка с горящим составом ? Да и зажигается он не от лазера, а сам по себе. Если б одно видео,а так все (ПЯТЬ !) с попаданием в абсолютно одну точку. ФЕЙК !",1,2,0.0
wiBhzhQu_2c,Hey girl hey🙋,0,0,0.0
LHR2gzqUp5M,Rob is so supportive in this,0,0,0.5
Y8kAZAQ5dX0,Wack,0,0,0.0
wUHWzsF_qJM,I love you,0,0,0.5
_5ZrSKpbdSg,"Thank you NASA, for wasting $3.26 billion dollars on useless information we do not need. That's tax payer money btw.",1,7,-0.5
2HcqS508lIo,Magnets = Magic,0,0,0.5
_r5eTelhpmQ,I've always enjoyed his music. Hootie and his solo country is just great music!,0,0,0.75
