video_id,comment_text,likes,replies,pol
txvKrTplOVs,Best thing I've seen all week. Easily.,0,0,0.7166666666666667
5Wiio4KoGe8,top 3 best songs of 2017 so far:\n1. something Just like this ( Coldplay and the chainsmokers)\n\n2. what lovers Do (maroon 5 and SZA)\n\n3. DESPACITO \n(Daddy yankee),0,0,0.75
4cfL9nTNugM,"When will you guys come back?!...\nThat's all I'm asking,\nIs it too much to ask?",0,0,0.2
R6ja9qNmOaM,First of all wade ain't even in the top 100 mf averaged almost 20 a game n demar 38 headscratcher,0,0,0.11666666666666665
BnxkuaQxe9A,This one won first place,0,0,0.25
nqnkBdExjws,"Nice song, but all I'm really hearing is recycled James Arthur. Just me?",0,0,0.4
IvQQJmWdtH8,sometimes the night cuts through me like a knife\nThey've done it again.,2,0,0.0
9k6S9v0FKzI,what is that song called at the beginning,0,0,0.0
DprHLyvhbSg,Best bed in the world see breaks bead omg lmfao I died,0,0,1.0
UwK-WDjdMxo,"hey alisha, i am wanting to start a channel, but im having some trouble, i was wondering if i could get some help",0,0,-0.2
Ef93WmlEho0,Clear your throat why don't you...or swallow,0,0,0.10000000000000002
-CEuQhqNzz4,ИЗДАЈНИЦИ РОДА СВОГА!!!,0,0,0.0
WFb0EDl-JS8,Mayim....Weinstein would be hitting on Women if he ran a fast food franchise and he'd think that they would want to hookup in men's room if they smiled will handing them their order. There are those that believe the world exists only to serve them or get in their way and it's a nureological reality they have that can't be unlearned.,0,0,0.26666666666666666
mrTHfBCduRA,That title gets me horny every time👅💦,0,0,0.0
5Vd10gwNJRs,LOVE THIS DUDE!!!,0,0,0.9765625
_pc1kON-doU,This is amazing and everything.,0,0,0.6000000000000001
WfjZ1otkS3o,"In the marines, it didn't matter what race you were. They treated everyone like shit. This is just another reason why USAF is a joke lol.",0,0,0.30000000000000004
MiFeES9uOSo,"I haven’t seen the movie, I know like nothing about it but love the hairstyles",0,0,0.5
doUdRCrK80E,Pretty enough girl but so obvious having zero endowment is a big reason why she's cast,0,0,0.0625
8NArIVIQ4BI,Is this a cry for help?,0,0,0.0
vWmjyYh64vg,Congratulations to 10 years! I came across you when you were talking about the smurfs movie.,0,0,0.0
QpfgRpL1VVk,"this so beautiful,i like it a lot what a beautiful voice of avril lavigne,idol thank you,thank you so cool.",1,0,0.6
VzPD009qTN4,Yeaah GUT Science B**ch!,0,0,0.0
_oO0pd8VJjY,Pho is best pho,0,0,1.0
aiUq5xksJy0,"But hydrogen *is* a metal -- it's in the alkali metals with lithium, sodium, and co.  No one who's seen a periodic table should be surprised at its propensity for becoming a conductive blood-red crystal at high pressure/low temperature.  It's also a halogen, but that's what happens when there's only charge enough for an S-shell... you wind up with something that can make a table-salt-style alkali-halogen salt with itself.",0,0,0.14200000000000002
CuXq1hOa8_Y,"need more migrants to England. this is god's way of punishing England for the many sins of the Beattles !   gods wrath us upon England for the Beattles satanic music clearly heard , satan is god  when played backwards at 45 rpm !!!!",0,0,0.4563802083333333
oUb-TwzDnk8,Jp for the win,0,0,0.8
6v-oVPROexw,I love your songs!😭😻😭😻😭😻😭😻😭,1,0,0.5
VHG7mHKwQqA,I'll shoot ya in the back,0,0,0.0
fiEYKSMcHAI,SHUT UP MYEM,0,0,0.0
RVSSCN2ts_g,ENEMY UAV IS AIRBORNE,0,0,0.0
VsXu80J31uc,You mean insects..,0,0,-0.3125
TBJIAgiIHg4,":,v se pasó el guardia x,DD ¡¿Qué no sabe quién es Becky G?! Pero.. en realidad era lo que quería, que Becky G cantara y bailara con las chicas",2,0,0.0
x2l1vZ9dvAE,420?,0,0,0.0
QrNk6lHyDbk,She's so cute when she laughs,0,0,0.5
Xul7ku1XxRY,this song make me love mgk,0,0,0.5
dWWQsXRwHb4,I thought I wasn't ganna laugh until she kept saying Goodbye Vaughn... in that voice XD,0,0,0.3
ZczwzVhai9E,Its toasty\nLet him stay\nHe could meet the devil,0,0,0.0
RLmqKBRqyA8,Missed opportunity for a epic quote at 10:53,0,0,0.1
qCH73iQAZS4,No way he fought bums n ducked tj Anderson silva is the man faught every body at 185 and 205 this fool pussyd out just to get the recored,0,0,0.0
kmgsC68hIL8,"3:12, um actually,  that's not a new tesla.",0,0,-0.03409090909090909
8ZRCdfaAIy0,In case you didn't make it. Strabucks near my house are looking for an employee btw,0,0,0.1
_pc1kON-doU,"Before she judges others looks, this girl better fix her eyebrows tho🤔",0,0,0.5
LXAU1VqbYbo,2:57 He has three arms?,0,0,0.0
qy-UZ5B38-Y,Anna’s my fave,0,0,0.0
ruRvc4huFkE,When YellowClaw said in every song yellow motherf***ng claw\nThen Krewella should say krew motherf***ng ella too .. hehe\n\nBtw .. this one fire!\n,0,0,0.0
DprHLyvhbSg,3:06 me lol jk,0,0,0.8
FvcNr_5uWgY,"he has always cited Kim Burrell,Whitney houston and Mariah Carey as her musical influences, you can hear that in this song.",0,0,0.0
Ayb_2qbZHm4,B O N L E S S,0,0,0.0
CwLGro-dFWg,i cant wait for the MV of this song OMG!,0,0,0.0
0fsKoK9yLE0,What is Gods holiness??,0,0,0.0
MeGyZJiB-FQ,I don't get my phone for 2 months,0,0,0.0
2DTwXdqmRiM,Who thought there was gonna be a twisted plot where James and Channing was gonna start falling in love and make out???¿¿?? #justmeok,0,0,0.0
pAsN4lSa7O0,Blake Shelton is the new King of Country next song he sings should be a remake of Michael Jackson song,0,0,0.06818181818181818
Ap5hoCTkTUM,Wow Lele is a bitch sitting her ass in that guy's face,1,0,0.1
658YZO_CmOk,YOU MADE FUN OF HAMILTON,0,0,0.3
MrujGOjzUI4,So freakin dope lol,0,0,0.8
AR764HY82Cs,"2:30, that was perfect",0,1,1.0
GMFnJln3IEA,That you for uploading 😂😂,1,2,0.0
QX6_UViEpOg,Not interested in ever buying a Tesla,0,0,-0.125
LpZqwLZP5Vs,Prayers to everyone who was affected by this terrible event ❤🇺🇸🙏,0,0,-1.0
wiBhzhQu_2c,You should try putting oil (i use straight oils-think olive or sweet almond oil) on straight out of the shower at night (if you use an oil you shouldn't dry your skin before applying it) it's so hydrating and luxurious (crunchybetty.com has an amazing article on the oil cleansing method and which oils are best for which skin types and i use that as a guide for my body oils),0,0,0.38055555555555554
HzIB6TC1Ghw,bunch of losers,1,0,-0.2
8VzoqU5IQT4,How canI join Intel so I can make machines seriously,0,1,-0.3333333333333333
yAZwhN-WKGg,A supposedly grown man being paid millions of dollars for playing a child's game. \n\nNot a lot of room to talk.,0,1,-0.4
VcMuDnnaBvw,"Kim--Your words are spoken, my words are sung! You fear, I watch. You talk, I take action! I look, you hide! I dance in the light, you crossed over.  I've been to hell and back, you've been to target! I've died in this life in many ways, you fear death! I love with my heart, you love with your money! I'm loyal, you're a coward!  I make sense, you spend cents! I've felt death in my hands, you've felt nothing!",0,0,0.42247023809523804
v90yrcg6q9I,Well bye.....,0,0,0.0
_iBpGz54ngs,"Вот уже много лет слушаю Кемпа, Слава  Господу за эти песни...",0,0,0.0
rCo4gIZu0DY,THE MIDDLE FINGER CAT SHIRT \n(i think thats it ),0,0,0.0
E5Hfl6Nqw3Q,did he just diss lil JoJo?,0,0,0.0
qZVm-2nM0sA,*BEFORE 100K*,0,0,0.0
MTIzurDnEsk,Omg this was so amazing!! Dainà gyal yah beat dem bad!!!! 💕💕,0,0,-0.031249999999999944
OZAfse9Pb4c,LØL,0,1,0.0
t8sgy0faXyg,Love 👏👏👏👏👏👏👏👏👏👏👏,0,0,0.5
j8ziXMTpkL4,*K U K U M B R*,2,0,0.0
fwDZ8uhqJg0,"Don’t press read more, trust me don’t you will regret it\n\n\n\n\n\nOk ok ok wait you did it just please don’t scroll down \n\n\n\n\n\n\n\n\n\n\n\nWait wait wait! Don’t PLEASE YOU \n\n\n\n\n\n\n\n\n\n\n\n\nWILL\n\n\n\n\n\n\n\n\n\n\nDIE!!\n\n\n\n\n\n\n\n\n\n\n\n\n\n\n\n\n\n\n\n\n\n\n\n\n\nDon’t \n\n\n\n\n\n\n\n\n\n\n\n\n...you will regret it\n\n\n\n\n\n\n\n\n\n\n\n\n\n\n\n\n\n\n\n\n\n\n\n\nNothing is down here but......misery \n\n\n\n\n\n\n\n\n\n\n\n\n\n\n\n\n\n\n\n\n\n\n\nWarning ⚠️ now entering the dark web no turning back \n\n\n\n\n\n\n\n\n\n\n\n\n\n\n\n\n\n\n\n\n\n\nWe will find you, we have your IP\n\n\n\n\n\n\n\n\n\nAll rights reserved copyright © 2017 by CI trippy",0,0,0.14285714285714285
HcNcOnIkQQU,Perfect song!♥,1,0,1.0
s7u5igc-lFg,Comments section: \n\n\n\npInK iS eVeRyOnEs CoLoR\n\n\n\n\nITS A HISTORY LESSON SHHH,0,0,0.0
NMRvbg-denE,"LOCK HER UP!! SHE KNEW SOMETHING. IF SHE DIDN'T, THEY WOULDNT HAVE SUSPECTED HER IN THE FIRST PLACE. PRETTY SURE HE IS THREATENED THIS TYPE OF MASSACRE EVERYTIME THEY HAD A FIGHT!",0,0,0.375
iX6ScurPhCo,"Interesting fact....De Beers created a supply and demand monopoly on diamonds and they are really rare and are not worth much at all. De Beers held stockpiles of them to create a huge demand for them and created a huge advertisement campaign in the early 20th century to make diamonds popular. Before that, people didn't propose with expensive rings (which really aren't expensive in reality).",0,0,0.12916666666666674
8rhb5wTCero,6/10 IGN,0,0,0.0
7D4-49pkEWY,This guy is a BAMF.,0,0,0.0
8ijNvyEbQ_g,same u like Frankie but he did not deserve a score higher than Jordan and Lindsay.,0,0,0.125
PeUgWK0pUIA,You guys are JUST NOW realizing this. Where was this revaluation with xenosaga,0,0,0.0
nvAhI3ZjnjU,Listen To Jays Tupac impression,0,1,0.0
etn4P80K5WU,I love how different all of their songs are. bc sometimes I feel like sometimes bands recycle a song to make similar ones but wolf alice stays creative.,0,0,0.25
yyv2gOHMGEc,"Man, I've always said while watching these that I would NEVER fork up the cash for the most high-priced choice, that no one meal (except maybe your last) would be worth that much money.  I think this video changed my mind, though.  LAMB PASTRAMI.  CRAB CLAWS.  LOBSTER FREAKING WAFFLES.  Holy gods.  Also, that was the *best* Adam-smile in the world when he got the gigantic pancake pizza; he is adorable when he smiles.",0,0,0.4166666666666667
Auu9Sxxt5is,19 seconds outside a spacesuit your die of rads lack of oxygen and that's best possible scenario worst is that  you'll get pulled into earths orbit and fall from space at 25 000 miles per hour into the ocean were no one can find your corpse,0,0,0.0
bHT4pO0VcXI,Alguien latino? 🙊,0,0,0.0
2UMfEfUR7wM,"Damn, she has terrible eating habits.",0,0,-1.0
KwcfpkTKEF0,I wish I was Shay’s assistant!! Besides working you get to have fun and be friends with Shay?! Yes please!!,0,0,0.5859375
mJSViC_Sx20,JONATHAN ANDJS NANCEJSDH,0,0,0.0
LunHybOKIjU,Biggest waste of 5 mins.,0,0,-0.2
dDiCuZTjS18,haha this stupid aniation for kids,0,0,-0.29999999999999993
470TG3AdA1A,ARE WE GETTING UBIK?,0,1,0.0
nd_EYo96lmo,I Love so much!!!,1,0,0.4453125
_yvDc9t1gZE,The music in the intro/presentation is like The Lawnmower of doom! 😂 very nice build Jason!! Your work is simply amazing:),1,0,0.7000000000000001
0s8oYNL1M-A,The dream team!,0,0,0.0
h9TlaYxoOO8,Another keyboard festival group. Next.,0,0,0.0
rdXaw4EFGdk,If pink was a chick id smash,0,0,-0.1
cFVRCo6-FUU,I could smell the pumpkin spice emanating from this video wow,0,0,0.1
5PaDeyRNUyc,I'm not even a subscriber: but I LOVE Kylie-and I didn't even KNOW she had a channel. Def subscribing. <3 \n\nP.S. My parents don't approve of her but I like her-trying to tell my parents that she is just living her life the way SHE wants it. Ugh,0,0,0.5666666666666667
XfiXby489Rk,They're baaaaaaaaack.... 😍😍😍,1,0,0.0
7Cn0-CwintU,I think you can have a good time with Kim.,0,0,0.7
tmGMd2bqh6o,"Of course I know what the 5th Dimension looks like, they were a good musical group during the 60s-70s. ;)",0,0,0.31666666666666665
cmSphKD18uo,Can you do this with all of your different types of makeup and then wear all of the makeup that you mixed together on your face for a day.,0,0,0.0
JU21shbaVBo,"Oh god , i didn't notice all that",0,1,0.0
rtL5oMyBHPs,I grieve in stereo \nThe stereo sounds strange,1,0,-0.05
2t4gy3oAx7I,I didn't know Trump was also gey .,0,0,0.0
WQjO1mMCPg4,Nice,0,0,0.6
iv1zeGSvhIw,Wow! Kerbal Space Program has great graphics since the last updatr,0,0,0.30833333333333335
t8sgy0faXyg,Goodness! AXL looks like total shit!,0,0,-0.125
MHMdv2D7ndc,Always breathtaking,0,0,1.0
q066h0yUoRA,She looks like a boss. Yaaas,0,0,0.0
VX4MQYwAh80,#5000 l love you,0,0,0.5
Pxojz6grwcU,Mad cow happened because even God couldn't take mothers being fed to innocent children. I hope someday aliens do the same to us.,0,1,-0.06458333333333333
nIZb34JnFEw,Y'all need to do a hurry up lyric video!! The beginning of the video is way to long.. I love it tho!!!!,0,0,0.44687499999999997
thUp8jTeJ9Q,is it a wig or real hare but no matter what I love it keep doing it in the videos💋❤💙💚💛💜💓👍👌,0,0,0.35
LDXr12ToYuM,(I promise) SORRY I HAD TO,0,0,-0.5
L_vQW3xQEhc,сталина можете слепить?,0,0,0.0
htpR770aP2k,this isn''t funny at all... is that a laugh track they play over this crap?,0,0,-0.08333333333333333
658YZO_CmOk,Heh the US doesn't care for Puerto Rico for years to come. They might as well as run for independence.,0,0,0.0
zyPIdeF4NFI,"This is proof of how the youtube algorithm is rigged.. You have gotten 11k views in 11 hours, which doesn't even come close to what is actually trending (views). All you have to do is put a big youtuber that is in kudos with the platform itself.....",0,0,0.0
mlxdnyfkWKQ,"Holy fuck I thought it was a fake bear, but half way through I realized, that's a real fucking bear",3,0,-0.49166666666666664
XM23h-eJ08A,Do with the Indian cricket team champs..😎😎😁,0,0,0.0
o5xxIciBSME,Can someone explain why would apple rather invest billions into another company rather than setting up their own suppliers/factories for all their needs ? Could it be that apple plans to take over LG or something ? or is it because they get to pay less attention to the manufacturing of their parts ?,0,0,0.21666666666666667
csrYDgBF2nI,good dub,0,0,0.7
aiXo6WyhCJs,"Quality content, sd",0,0,0.0
zcqZHYo7ONs,"Like minutephysics, have a beard, wear glasses. Checking in.",0,0,0.0
a_MFkqMZTt4,"I never comment on videos but I have to say, I love hot ones, Sean and Artie. These interviews are just so damn unique and real that I can't get enough of them. Sean, you ask some of the best and most intriguing questions and the hot sauce making people drop their guard and come out of their comfort zone is key. Keep it up guys at First We Feast. Love you.",0,0,0.34375
xPS7bqBePSs,This is such a great song. I just love this song.,0,0,0.43333333333333335
Z7R8XRKqHAI,Her laugh at 2:25 hahaha,0,0,0.25
nMABVXrg3D0,"Stumbled Upon your channel last night when looking up Anime themes... and I have to say... I've fallen in love! you sound amazing...\n\nalso, as a request, perhaps one of the Code Geass Openings.... I would love to hear you do O2",0,0,0.38125
iGHDJ2_hsKE,that looks like so much fun:),1,0,0.4
vVnJKV8aScc,I miss the Halloween videos so much 😭,0,0,0.2
D6oaRAgdslE,"*Note to self.  Don’t include part of video from 15 yds away (more than half the bullets hit the target, target actually fell over).  *Forgets to remove part of video from 15 yds away.  “God dammit” 🤦🏻‍♂️",0,4,0.11111111111111112
ZT1JsE_YbFs,An idea I had is maybe you could do another Undertale food? Maybe you could do The seven souls as cupcakes? Like just put the souls heart symbols on cupcakes and this is optional but you could write what trait the colour of the soul represents?,1,0,0.0
76WkDuiAjeY,Or make a bear bear plushie cake with Laurdiy,0,0,0.0
8Lv3tW7bWzU,"Emily, read Ghost Map by Steven Johnson! It's a nonfiction look at a London cholera epidemic in the 1800s and a scientist trying to prove it came from contaminated water and not the popular miasma theory. I learned so much cool and gross stuff!",0,0,0.31666666666666665
nJSrCX1U1hg,Love your vids,0,0,0.5
h2K_SWpQtb4,There's more people in a Walmart rite now..than the whole country of Trinidad y tobago.and  USA  soccer team can't  get a win or a draw...,0,0,0.5
DHYRxML2SpA,I'd name mine max,0,0,0.0
wd9-VP2LzM8,"Would it pair with an iPhone 6? Like can I play Spotify with it or say, ok google, what's the weather today?",0,0,0.5
0ptNpGfMRCg,@everythingapplepro  wasup man?! I’m from Moses Lake WA. Haha,0,0,0.2
7wwTAo01AKs,Jesse is a liar or uneducated.,0,0,0.0
bxgFjzRW6EA,"Hi, I think the portkey was originally 1-way and Barty Crouch Jr. just had to make sure Harry touched it first. There was no intent to return to Hogwarts. When the Priori Incantatem spell released the echos of Cedric Diggory, Frank Bryce, Bertha Jorkins, and Harry's mum and dad, all trying to save Harry- their lasting magic enchanted the portkey to return back to Hogwarts, to safety, to Dumbledore.",0,0,0.2708333333333333
mJSViC_Sx20,Please don't go deep in this love-interest subplot. Just stick to the original genre.,0,0,0.1875
D59v74k5flU,3:47 kreygasm,1,0,0.0
N_zDcuX1Y54,you're skin has been clearing up rlly nicely omg,0,0,0.6
_pc1kON-doU,So this is how high schoolers are supposed to dress up now?.... am i still in middle school then,0,0,0.08
yWatz9TAgT0,"1. youre so brave doing this vid!\n2. I use brow pencil (sephora brand) and dark eye shadow (NARS coconut groove) to darken empty spots lol. It is the most natural color i can find and even though it is pricey, it lasts for a year or two",0,0,0.325
5qkgFES0r-U,"Omg! i didn't know that was that much negativity! and i been warching you for a while and i didn' t think that i should say, because i think that you weren't that affected about all that, but keep going on what you do! and keeo smiling!💕",0,0,0.3125
CwLGro-dFWg,Why the hell is an fracking Google Mini in this Video??? Haha sponsored? 🤔,0,0,0.2
TngCi2s5rmk,JOEYWORLDTOURS,0,0,0.0
vaAzCXxAoQE,💩💩💩🖕🏻🖕🏻🖕🏻🖕🏻🖕🏻💩🖕🏻,0,0,0.0
oDIDZ9EmQfA,"Did anyone else notice Caoimhe and Tyler's heavy flirting, rip Ryler!",1,0,-0.25
p_P9J97ELlg,Tessa Brooks looking ass 😭😂☠️,0,0,0.0
wQD1JvJZXdI,Cool. But whats good with a Jaybird Run review?,0,0,0.5249999999999999
yG-yfbDscbo,stars wars are such a stupid fucks,0,1,-0.39999999999999997
Xtqr1C6eDmY,"That last footage was magic.\nIt’d be great to see slo mo footage of different OLED screens, from cheap flickering to high quality seemingly continuously light emitting. Not very fancy perhaps, but very informative.",0,0,0.2325
VcMuDnnaBvw,Wow I love this item. http://amzn.to/2xJYbzw,0,0,0.3
fcubmjoGH7I,aw this was posted on my birthday,0,0,0.0
CEcrgOuBiUM,I bet NASA is looking at this stuff they are coming up with and taking design tips and remodeling so they are functional.,0,0,0.0
w8fAellnPns,Did anyone else see the gnat on the cutting board @0:51?,0,0,-0.6
xGd8KIXqPJY,Jenna Ushkowitz ❤️❤️❤️❤️,0,0,0.0
WfjZ1otkS3o,This man would make a much better president!,2,0,0.625
zcqZHYo7ONs,"The wildest part of this, and the part I always love talking about with fans of learning, is what happens when you take those entangled photons and put three filters in front of one of them, an A, B, and C, each rotated 45 degrees from each other, so that the polarity of the photon rotates by 90 degrees. Then you pass it the entangled partner through a C, and see if it passes through. If the photons were really not entangled, the entangled photon would get blocked exactly when you would expect it to pass through, and vice versa! Entanglement is wild!",0,0,0.14250000000000002
JgYfZAjOgEM,wow i can't believe its been almost three years since your slumber party stop in new jersey. i was the first question you answered that night but what made this moment so special was you commented on my name. you asked me if i ever feel like people just assume i have an h in my first name and they do but then you told me I'm beautiful with out which meant the world to me thank you so much for taking the time to make so personal. keep it up your videos always brighten my day love ya the video is on my insta @sarasmiley and Facebook sara smialkowski if you want to see this lovely moment,0,0,0.3143506493506494
FpZ1sIjQrf4,Haha I Love You IISUPERWOMANII,0,0,0.35
X7ld45pUueQ,"It looks wavy but not hurricany \nEveryone, please watch my tiny nature videos. There is no talking in them. Shhh!",0,0,0.0
uxI-8GTqDYA,Its simple \nWatch Primitive Technology,0,0,0.0
_iBpGz54ngs,Amei ❤ glória a Deus ! 🎶🙌,7,0,0.0
StJTV8bx-jk,Bru that field goal was not made,1,0,0.0
5CHJbMnLPKw,Dear Nick it's a fucking video game.,0,0,-0.5
eERPlIdPJtI,This guys awesome,1,0,1.0
S5Esa9L4nvE,#YIAYtime I would go back to when YouTube was first created and warn them about your channel so they decide not,0,0,0.125
ETR9qrVS17g,"Well, this video is actually quite right. However it works on the same principles as if I told you the benefits of burning trash, but neglected the negatives.\n\nin 1968 racism was officially illegal, it is therefore prosecutable to do racist things (such as not allow loans to black or white people). However since 1968 we have passed laws into a different direction. Under the pretext of fighting racism - we have created racism. Today an asian must score much higher on their tests to get to the same university as a black person, black people get much more gov’t subsidies/help under the idea of everyone is the same, so we MUST pay for the one lacking...\n\nThe point is this. Today america is becoming racist to its founding race - whites. You can look it up, there are cases when some people dyed their skin black to get into college. I hope that with the rise of BLM and antifa (and their inevitable massacre under the pretext of “terrorism”) that these policies will be lifted. \n\nRemember - does the descendent of yugoslavia (Serbia) pay the nations that seceded? They commited many atrocities, yet they dont pay anything... does Austria? Austria controlled Slovenia for 1000 years, is slovenia supposed to get money from austria? Where does this end? Will the US get money from the UK? Or will the UK get money from the US?\n\nRemember that the triangle trade only happened because blacks themselves sold their kind for european technology - it was their choice, knowing full well what would happen. Should blacks pay whites because they got them to america?\n\nAs you can see this is where this eventually leads. This video should be taken as propaganda. Using past justifications for the policies of today is extremely close to what the nazis believed in.",0,0,0.04977106227106227
JV1NB70gLQI,"I think there's a mistake in the number of employees mentioned for Microsoft. Clearly it has more than 250,000 employees.",0,0,0.3
v9ERab8P6Io,Nice #44OnTrendinh,0,0,0.6
lQX0jvVQywQ,Mitch makes me think of Freddie mercury with that look,1,0,0.0
KbYCmEptlL8,Can you do this the other way round. Kylie do Jordan’s blindfolded,0,0,-0.1625
dpMFGr-wznc,Mail privilege doesn't exist,1,0,0.0
DOz4H0jlthc,Good bye dirty Old man,7,0,0.06666666666666667
nivfxoep6Rs,BACK TO NIGGERTOWN SEWER WORMS,0,0,0.0
5Wiio4KoGe8,Such an imagination on this video😊,1,0,0.0
SmfWvo4cMpU,So happy for you sweet girl!💕 stay positive and bubbly!,0,0,0.478030303030303
KCiahBMis1E,july 21th,8,2,0.0
bxgFjzRW6EA,"That is, if Wormtail could get past Crookshanks...\nWHICH I DOUBT\nYeah, Crookshanks would just attack Peter while he was sleeping and then everyone wakes up and sees Peter lying in bed, dead. I think that would be hilarious.",0,0,0.016666666666666663
9yUZTTLpDtk,Can Cliff Stoll be my professor?  Please?,1,0,0.0
iTRWe2XGEGA,Saw the baby - wanted lunch.,0,0,0.0
EbthMC6spAE,"Wow. I went through that video for 7 minutes listening with mild amusement and thinking He really does sound like a comic genius, but one that isn't quite my taste. Then that last punchline hit me. It's taken me 10 minutes to stop laughing long enough to write this comment.",0,0,0.15416666666666665
y_nuMEtwUW4,This is awesome!  This guy knows how to make college football great again!,2,0,1.0
R_jKUDmJs1Y,"Dear Ryan, I dare you to do an interpretive dance of Taylor Swift's songs 😊❤❤",0,0,0.0
4X6a3G_0HjY,F this I need sum  Max shit,0,0,-0.2
DBBt7IhHOFQ,Upgrade\nFuck Go Back,0,0,0.0
4YX_1wql-Xw,Girl?,0,0,0.0
x5Ps13AeXxQ,Please do the shaytards,0,0,0.0
wGwsgf5CdxU,Why not Gareth Edwards for E9? He doesn't have any projects going on.,0,0,0.0
ICqTZeiimpk,"Patriots, go to your local NFL practice facility and loudly play the National Anthem while holding the American Flag. Organize locally. Film it. Do it as often as possible throughout the season.",1,0,0.02
11S5tcT2Tm0,"Violin + oriental dance, - perfect!!!",0,0,1.0
-cYk6sbe11c,looks like a marshmallow,0,0,0.0
ZYSjPZUqLdk,"Yeah, but most importantly, did he ever wear a tan suit?????",0,0,0.45
c7ymY8QEB2g,How can someone call kirstie a slut when she's that flawless (yes I know it's for the video),1,0,1.0
j5YSOabmFgw,I didn't know this song existed but I wasn't ready,0,0,0.2
0PKthlZtLDo,24/7 rent free in all of your heads,0,0,0.4
3d9i_0Ty7Cg,Whovever is my \nProgrammer pressed that randomize button hard asf,0,0,-0.2916666666666667
1KCZHHMZVGQ,"It's called your LIVER and your KIDNEYS. Eat well, avoid the drugs and booze and you're toxin-free!",0,0,0.0
gOsM-DYAEhY,woww beautiful video!!!! i hope its art and creativity will get a recognition soon,0,0,1.0
L6QAx5mqFKU,A week has 21 meals... where is the rest of your food?,0,0,0.0
gQvHtXWlXDE,Ya bu yeşilçam müziği o yüzden türklere güzel geliyo,0,0,0.0
ei6FVbMysc4,Adorable,0,0,0.5
Ri4xPHGS5f8,He's got the full denim outfit on,0,0,0.35
cOboLQMO4tQ,FUCK Jemele HILL stupid bitch,0,0,-0.6
VGBZ2YfVx1Y,i love u guys so so much and idk how u do it but u guys are awsome,0,0,0.35
